<?xml version="1.0" encoding="UTF-8"?>
<tester-config xmlns="http://www.example.org/config"
	xmlns:xsi="http://www.w3.org/2001/XMLSchema-instance"
	xsi:schemaLocation="http://www.example.org/config ../tester-core/config.xsd">
	<locator-class>br.ufmg.lcc.arangitester.ui.DefaultLocator</locator-class>
	<login-controller>@package@.login.LoginController</login-controller>
	<environment name="@user.name@">
		<browser>*firefox</browser>
		<port>8080</port>
		<host>localhost</host>
		<path>/</path>
	</environment>
</tester-config>